{
  "schemaVersion": 1,
  "source": {
    "logicalPath": "CoHocLyThuyet_Full_New.docx",
    "sha256": "6396a72512613f867f93332968fc876daccb1d65ed3b6d52efaa74d44bf4b79a",
    "docxManifestSha256": "a49f6fb6adaf5413d4cd9f2ed507cbaf7fcc5c059b8914d76089dcafa7bed29e",
    "chapterReference": {
      "logicalPath": "data/chapter-reference.json",
      "sha256": "0b2272d54d6a3d3152562eab58b6cbf241860971e4a0932c79bb05c142fb1187"
    },
    "pdf": {
      "logicalPath": "CoHocLyThuyet.pdf",
      "sha256": "b755b06cf919a979e278f635aa2fedfe249a97342ccd93d2d15875e87ff835d9"
    }
  },
  "generator": {
    "name": "tools/build_content_manifest.py",
    "version": 1
  },
  "routes": [
    {
      "routeId": "lnd",
      "title": "Lời nói đầu",
      "sourceHeadingPath": [
        "Lời nói đầu"
      ],
      "chapterFile": "chapters/loi-noi-dau.html",
      "bundleKey": "lnd",
      "contentHash": "8dd425e0e94067175f7e1e4d6b98f4bce5521ef432adb3949543ff858b8e7494",
      "figureRefs": [],
      "equationRefs": [],
      "hasQuiz": false,
      "hasSimulation": false
    },
    {
      "routeId": "ch1",
      "title": "Tĩnh học",
      "sourceHeadingPath": [
        "Chương 1",
        "Tĩnh học"
      ],
      "chapterFile": "chapters/ch1/index.html",
      "bundleKey": "ch1",
      "contentHash": "4b3b044831bcc1a38d76e65ac6b2e91c1772512e5226c90c484ea2284b313df4",
      "figureRefs": [],
      "equationRefs": [
        "ch1#eq-1",
        "ch1#eq-2",
        "ch1#eq-3",
        "ch1#eq-4",
        "ch1#eq-5",
        "ch1#eq-6",
        "ch1#eq-7",
        "ch1#eq-8",
        "ch1#eq-9",
        "ch1#eq-10",
        "ch1#eq-11",
        "ch1#eq-12",
        "ch1#eq-13",
        "ch1#eq-14"
      ],
      "hasQuiz": false,
      "hasSimulation": false
    },
    {
      "routeId": "ch1-1",
      "title": "I. KHÁI NIỆM CƠ BẢN",
      "sourceHeadingPath": [
        "Chương 1",
        "I. KHÁI NIỆM CƠ BẢN"
      ],
      "chapterFile": "chapters/ch1/muc-I.html",
      "bundleKey": "ch1-1",
      "contentHash": "667043dacf4c50911815a9bc9a232c34b6b0ac945565b9b630c0cbaa6dd7d379",
      "figureRefs": [],
      "equationRefs": [],
      "hasQuiz": false,
      "hasSimulation": false
    },
    {
      "routeId": "ch1-1-1",
      "title": "1. Vật rắn tuyệt đối",
      "sourceHeadingPath": [
        "Chương 1",
        "I",
        "1. Vật rắn tuyệt đối"
      ],
      "chapterFile": "chapters/ch1/muc-I-1.html",
      "bundleKey": "ch1-1-1",
      "contentHash": "7e41613c6a086b33988b71cd15a4ae4c05872110061170dbed833421795310d7",
      "figureRefs": [],
      "equationRefs": [],
      "hasQuiz": false,
      "hasSimulation": false
    },
    {
      "routeId": "ch1-1-2",
      "title": "2. Cân bằng",
      "sourceHeadingPath": [
        "Chương 1",
        "I",
        "2. Cân bằng"
      ],
      "chapterFile": "chapters/ch1/muc-I-2.html",
      "bundleKey": "ch1-1-2",
      "contentHash": "f86af3437f3c8ec1dc254bc5f24e946998761062a29556c838482da104a5bc1a",
      "figureRefs": [],
      "equationRefs": [],
      "hasQuiz": false,
      "hasSimulation": false
    },
    {
      "routeId": "ch1-1-3",
      "title": "3. Lực",
      "sourceHeadingPath": [
        "Chương 1",
        "I",
        "3. Lực"
      ],
      "chapterFile": "chapters/ch1/muc-I-3.html",
      "bundleKey": "ch1-1-3",
      "contentHash": "d0f6036eaf3d9ca25e96ed8bd2f82c23eaf14228e8b331f8b2999377bc11337a",
      "figureRefs": [],
      "equationRefs": [
        "ch1-1-3#eq-1",
        "ch1-1-3#eq-2"
      ],
      "hasQuiz": false,
      "hasSimulation": true
    },
    {
      "routeId": "ch1-1-4",
      "title": "4. Mô men",
      "sourceHeadingPath": [
        "Chương 1",
        "I",
        "4. Mô men"
      ],
      "chapterFile": "chapters/ch1/muc-I-4.html",
      "bundleKey": "ch1-1-4",
      "contentHash": "c6377a3ed5f4f7a9c912dd299acbb06de34c44c6e1e95d6110ca05ab1a49917a",
      "figureRefs": [
        "images/ch1/hinh-002.png",
        "images/ch1/hinh-013.png"
      ],
      "equationRefs": [
        "ch1-1-4#eq-1",
        "ch1-1-4#eq-2",
        "ch1-1-4#eq-3",
        "ch1-1-4#eq-4",
        "ch1-1-4#eq-5",
        "ch1-1-4#eq-6",
        "ch1-1-4#eq-7",
        "ch1-1-4#eq-8",
        "ch1-1-4#eq-9",
        "ch1-1-4#eq-10",
        "ch1-1-4#eq-11",
        "ch1-1-4#eq-12",
        "ch1-1-4#eq-13",
        "ch1-1-4#eq-14",
        "ch1-1-4#eq-15",
        "ch1-1-4#eq-16",
        "ch1-1-4#eq-17",
        "ch1-1-4#eq-18",
        "ch1-1-4#eq-19",
        "ch1-1-4#eq-20",
        "ch1-1-4#eq-21",
        "ch1-1-4#eq-22",
        "ch1-1-4#eq-23"
      ],
      "hasQuiz": false,
      "hasSimulation": true
    },
    {
      "routeId": "ch1-1-5",
      "title": "5. Hệ lực",
      "sourceHeadingPath": [
        "Chương 1",
        "I",
        "5. Hệ lực"
      ],
      "chapterFile": "chapters/ch1/muc-I-5.html",
      "bundleKey": "ch1-1-5",
      "contentHash": "31b505f0693715dcaff417362930931de1442aa6606f0c04b40d9d34bbad44b1",
      "figureRefs": [],
      "equationRefs": [
        "ch1-1-5#eq-1",
        "ch1-1-5#eq-2",
        "ch1-1-5#eq-3",
        "ch1-1-5#eq-4",
        "ch1-1-5#eq-5",
        "ch1-1-5#eq-6",
        "ch1-1-5#eq-7",
        "ch1-1-5#eq-8",
        "ch1-1-5#eq-9",
        "ch1-1-5#eq-10",
        "ch1-1-5#eq-11",
        "ch1-1-5#eq-12",
        "ch1-1-5#eq-13",
        "ch1-1-5#eq-14",
        "ch1-1-5#eq-15",
        "ch1-1-5#eq-16",
        "ch1-1-5#eq-17",
        "ch1-1-5#eq-18",
        "ch1-1-5#eq-19",
        "ch1-1-5#eq-20",
        "ch1-1-5#eq-21",
        "ch1-1-5#eq-22"
      ],
      "hasQuiz": false,
      "hasSimulation": true
    },
    {
      "routeId": "ch1-1-6",
      "title": "6. Ngẫu lực",
      "sourceHeadingPath": [
        "Chương 1",
        "I",
        "6. Ngẫu lực"
      ],
      "chapterFile": "chapters/ch1/muc-I-6.html",
      "bundleKey": "ch1-1-6",
      "contentHash": "e1273b98844a20057087739e43417fae765a6891070b1810364e927343ddc5f4",
      "figureRefs": [
        "images/ch1/hinh-017.png"
      ],
      "equationRefs": [
        "ch1-1-6#eq-1",
        "ch1-1-6#eq-2",
        "ch1-1-6#eq-3",
        "ch1-1-6#eq-4"
      ],
      "hasQuiz": false,
      "hasSimulation": true
    },
    {
      "routeId": "ch1-1-7",
      "title": "7. Vật tự do và vật không tự do",
      "sourceHeadingPath": [
        "Chương 1",
        "I",
        "7. Vật tự do và vật không tự do"
      ],
      "chapterFile": "chapters/ch1/muc-I-7.html",
      "bundleKey": "ch1-1-7",
      "contentHash": "c65ddd0204c215d8a6368f6451d44139de8f654957d704b681254706acf58461",
      "figureRefs": [],
      "equationRefs": [],
      "hasQuiz": false,
      "hasSimulation": false
    },
    {
      "routeId": "ch1-1-8",
      "title": "8. Lực liên kết, lực hoạt động, phản lực liên kết",
      "sourceHeadingPath": [
        "Chương 1",
        "I",
        "8. Lực liên kết, lực hoạt động, phản lực liên kết"
      ],
      "chapterFile": "chapters/ch1/muc-I-8.html",
      "bundleKey": "ch1-1-8",
      "contentHash": "0aa9826f19756d572e7d51e5b137c6033ce82cafe17c9a9265019674474a68b0",
      "figureRefs": [
        "images/ch1/hinh-019.png"
      ],
      "equationRefs": [],
      "hasQuiz": false,
      "hasSimulation": true
    },
    {
      "routeId": "ch1-2",
      "title": "II. CÁC ĐỊNH LUẬT TĨNH HỌC",
      "sourceHeadingPath": [
        "Chương 1",
        "II. CÁC ĐỊNH LUẬT TĨNH HỌC"
      ],
      "chapterFile": "chapters/ch1/muc-II.html",
      "bundleKey": "ch1-2",
      "contentHash": "c107c181a13e03eeb2ed080390c807fbeb49c03a3a7121694a5aa5488f0a3ae5",
      "figureRefs": [],
      "equationRefs": [],
      "hasQuiz": false,
      "hasSimulation": false
    },
    {
      "routeId": "ch1-2-1",
      "title": "1. Định luật hai lực cân bằng",
      "sourceHeadingPath": [
        "Chương 1",
        "II",
        "1. Định luật hai lực cân bằng"
      ],
      "chapterFile": "chapters/ch1/muc-II-1.html",
      "bundleKey": "ch1-2-1",
      "contentHash": "03cc33304365730ef79a718c133985ee6a68520ba7cb6a5b1d689336975f2bc3",
      "figureRefs": [
        "images/ch1/hinh-020.png"
      ],
      "equationRefs": [],
      "hasQuiz": false,
      "hasSimulation": false
    },
    {
      "routeId": "ch1-2-2",
      "title": "2. Định luật thêm bớt hai lực cân bằng",
      "sourceHeadingPath": [
        "Chương 1",
        "II",
        "2. Định luật thêm bớt hai lực cân bằng"
      ],
      "chapterFile": "chapters/ch1/muc-II-2.html",
      "bundleKey": "ch1-2-2",
      "contentHash": "a9df0ebdcf075406a74d462c871da54f432172cdfdb148d0231ed87fecfc7b9b",
      "figureRefs": [
        "images/ch1/hinh-026.png"
      ],
      "equationRefs": [
        "ch1-2-2#eq-1",
        "ch1-2-2#eq-2",
        "ch1-2-2#eq-3",
        "ch1-2-2#eq-4",
        "ch1-2-2#eq-5",
        "ch1-2-2#eq-6",
        "ch1-2-2#eq-7",
        "ch1-2-2#eq-8",
        "ch1-2-2#eq-9",
        "ch1-2-2#eq-10",
        "ch1-2-2#eq-11",
        "ch1-2-2#eq-12",
        "ch1-2-2#eq-13",
        "ch1-2-2#eq-14",
        "ch1-2-2#eq-15",
        "ch1-2-2#eq-16",
        "ch1-2-2#eq-17",
        "ch1-2-2#eq-18",
        "ch1-2-2#eq-19",
        "ch1-2-2#eq-20"
      ],
      "hasQuiz": false,
      "hasSimulation": false
    },
    {
      "routeId": "ch1-2-3",
      "title": "3. Định luật hình bình hành lực",
      "sourceHeadingPath": [
        "Chương 1",
        "II",
        "3. Định luật hình bình hành lực"
      ],
      "chapterFile": "chapters/ch1/muc-II-3.html",
      "bundleKey": "ch1-2-3",
      "contentHash": "c0012f32522e4d0f76876a241bb132aa66bccb5367bb61fa3b97390f20620205",
      "figureRefs": [
        "images/ch1/hinh-031.png"
      ],
      "equationRefs": [],
      "hasQuiz": false,
      "hasSimulation": true
    },
    {
      "routeId": "ch1-2-4",
      "title": "4. Định luật tác dụng và phản tác dụng",
      "sourceHeadingPath": [
        "Chương 1",
        "II",
        "4. Định luật tác dụng và phản tác dụng"
      ],